Post Id,Author,Time,Title,Text
3r9s51,NightO_Owl,11/2/2015 16:26:42,b'That moment when you actually need them...',"b""For the past year, I've been a primary user of Oxy 30's. Started off as a weekend thing where just half a 30mg Oxy would have me nodding like crazy, to needing anywhere from 3-4+ to chase the Dragon. This past weekend was incredibly boring for me. I didn't go out and had no desire to do anything, even play video games. I've also been clean for about a week and half cuz I spent all my money on about 20+ blues the week prior, which at this point feels like an eternity since I've been without them. Sunday night rolls around, and as I'm getting ready to go to bed, I stand up from my chair, and the middle of my back is in excruciating pain. I don't know what I did to cause it. It's not like I stood up too fast or anything. The only thing I think could have caused it was earlier, I almost slipped backwards due to wet sandals because of a wet carpet from rain a couple days back. My left leg/ankle hurt quite a bit after almost falling, but I recovered. My current back pain hurts the most when I try to bend over to pick something up, and my left Achilles tendon hurts so much.\n\nI guess the point of this post is to just address how much it sucks, when you actually do need opiates for pain, and you can't even get them. Have to wait until Friday payday to go pick up. Hopefully, everything hurts less by then. Thing is, I was hoping to quit this time around too, but it seems every time I try, something like this comes up."""
3r9m8n,hatrix216,11/2/2015 15:50:13,b'What are you guys paying for dope around you?',"b""I'm pretty sure this is in the rules, I remember seeing similar threads but haven't noticed one in a minute.\n\nI was just talking to my middle, and I'm able to get fire ECP for 60/half 110/g now!! I'm stoked as shit. I start a new job tomorrow and will for sure be hitting him up soon. I have never gotten prices so low before.\n\nWhat's everyone else getting shit for so I can be jealous?"""
3r9c9p,pez_rusty_red,11/2/2015 14:48:57,b'The difference between our little safe haven (r/opiates) and real life',"b'Man, Im decently new to the game, i guess you could say, this is my second year doing heroin, and im still learning a lot about the whole shebang. Mainly, how serious the stigma is behind using drugs. On here, on this site, I can feel free to talk about my biggest exploits, my most embarrasing moments, and real low times in my life without worrying about everyone judging me and calling me a piece of shit, because weve all been there, or at least close, and if not we at least know that drugs dont make you a complete failure/waste of space. Im finding out in the past couple weeks, that no matter what, if you are a junkie and yer surrounded by sober people (or even cokeheads/alcoholics/pill poppers, ironically), you are automatically a bad person and should not be around for any reason, period.)\n\nI am learning this now because, well for the past 3 years, I have been working in aggriculture in a very small town in Nor Cal, and it has been a great 3 years. making lots of money. the first year i was on pills for a small amount of time, the second year i was on pills heavy the whole time and a little H, and this year i have been using H heavier than i ever have in my life, and low and behold, this year, the whole valley is thinking about 86\'ing me from work. Im hearding second hand of course that no one wants to work with me, witch is the real reason ive been out of a job i was promised, and possible out of the whole job next year. Things have been going missing from one of the houses the workers stay at, so of course, it was me, the junkie. According to my bosses, im a liar, a thief and i cant be trusted. also none of the workers want to work with me because they are ""afraid of having their ipod stolen"".\n\nAs im sure there are many of you who understand, drugs dont make you a bad person. which is why this is so hard for me to understand. I have done nothing but bust my ass for these people, and helped them out as much as i had the chance, going out of my way for numerous things, but no matter what i do or how good i am to them, all they want to do is talk shit and fuck things up for me because im such a ""piece of shit"". its really upsetting.. i could have done more to hide it but i just feel like thats not the right thing to do, hide who you are from people, its just not honest. so i didnt. i didnt go around advertising my usage to people but i didnt deny it either. plus in such a small town, word travels faster than the speed of light. so the minute my addiction came to light, im no longer wanted in this particular valley. \n\nthe most ironic part about it is, the last two bosses i had were the biggest bosses in the valley, they were also serious tweakers/alcoholics, totally unstable and fucked up people. Two of them (a cokehead and a tweaker)conspired to steal over $120k worth of merchandise from me last year. something no one batted an eye at. yet, me, a heroin addict, allegedly stole 1500 worth from someone, and now im considered a piece of shit. I just dont understand why the stigma with dope is so fucking bad compared to the stigma behind meth and coke and alcohol. i know theres also politics involved in this certain situation but even outside of this, it seems like no one who suffers from addiction is worth a goddamn minute of anyone elses time... just really erks me because i try my hardest to do what i can for people and this is what i get in return. just for being who i am. \n\nSorry for the big rant you guys but i had to get this off of my chest its really been fuckin with me lately. Anyone else going thru some type of shit like this? I guarentee there is... '"
3r981t,redrumcycle,11/2/2015 14:23:43,"b'Missed a shot. Not an emergency, but looking for harm reduction.'","b""http://m.imgur.com/zOfbI6u\n\nNow it's getting pretty red and swollen. Is there any danger to this? I'm having a really hard time registering as I'm a beginner to IV. :(\n\nMade a shot of 20mg gunpowder (tar) and accidentally shot 1/4 of it after I thought I registered. The syringe is red, so I must have registered and came out. Would I be able to shoot that liquid?\n\nThanks everyone!"""
3r8qqy,forgivemeb,11/2/2015 12:38:26,b'Falling in love and quitting opiates',"b""My feelings for you have brought me through an array of emotions--- joy, hope, bliss, gratitude,  motivation, and most importantly, happiness.  I havent felt happiness in years and you brought it out of me.  Always a pessimist, for once, I understood the feeling of optimism.  That was the strangest thing for me, finally knowing something that was utterly foreign to me my whole life through a decade of adulthood.  \n\nYou may not be completely cognizant of it or understand the extent to which its true, but you motivated me in ways that I didnt think were possible.  You made me feel good about myself when I didnt think there was a way to piece together my utterly shattered self-esteem, when I thought there was no hope for someone to care for a piece of shit like me.  You gave me confidence and made it worth it to me to risk everything.  Your presence in my life gave me the push I needed to pull the trigger on taking steps to begin achieving my hearts desire.  \n\nWith your help, whether you know it or not, I left a job that made me miserable.  I left a living situation I hated.  I moved to a city I love.  I wrote a business plan that got funded.  I started using my connections to find a job that will get me where I want to be mentally and financially.  I decided to leave behind crippling depression that has plagued me for years.  Could I have achieved these things on my own?  Yeah, probably.  But they wouldnt have happened with such quickness and certainly without such purpose.  \n\nAnd that is why I am absolutely terrified that I might lose you.  You caught me smoking dope the other night.  You said it wasnt necessarily the fact it was dope that bothered you, that you had a problem with my secrecy.  That the problem was my being inconsiderate and not asking permission.  That the problem was how I put things in your life at risk with my carelessness.  I completely understand that.  You are right to be pissed at me because I'm even more pissed at myself than you could ever be.  I care for you more than I can express, and those things, though I didnt consider it at the time, dont reflect that.  I dont want any act of carelessness to make me less fun to be around or to put anything in your life at risk. I understand that much of my behavior could be viewed as impulsive or thoughtless, but all of it prior that incident was motivated by my desire to be with you.  \n\nIm not mad at you for wanting to put the brakes on things.  I understand a lot of what must be going through your mind and I dont want you to have to deal with the embarrassment that comes with saying your boyfriend is couch hopping, homeless, unemployed, and addicted to opiates.  That stack of truths, partially a product of poor decisions and partially a product of my desire to put myself in your life before it became too late, is tough for me to even type.  It may sound romantic to some that I took many of the aforementioned risks in attempt to pursue you, but I also realize it doesnt entitle me to your heart and it doesnt make the undesirable truths about my current life status any less avoidable.  \n\nSo I want to use this letter to tell you what I want, my hearts desire more than anything.  These are my goals.  When I have goals that I truly want, I do whatever is in my power to get them.  In the past, Ive lost significant amounts of weight.  Ive quit drugs cold turkey.  Ive saved relationships that were on the rocks.  Ive started businesses and escaped the 9-5 grind.  Ive done a lot of things that seem like theyre impossible.  \n\nRecently, I made it to the city you live in against all odds.  I got out of the soul-crushing job by which I felt utterly trapped.  Ive scored two job offers in the past month off the strength of my friendships.  Ive managed to pull together a living arrangement that will last until I can get a place on my own.  And I will accomplish the things below if you will let me.  You dont owe me these things, but I hope with all of my heart that you will allow them to happen because I dont believe you will find someone who wants you more than me.  I dont think you will find someone who will love you more than me.  I dont think you will find someone who admires you in every way as much as me.  I don't want these things to happen any faster than you want to let them happen but I hope there is a possibility that they can become reality at some point.  So here it goes.\n\nI want to be your boyfriend.  I want to be your lover.  I want to be the man in your life that sends tingles up your spine.  I want to be someone you can be proud of.  I want to protect you.  I want to have a job that allows me the luxury of being able to pay for everything when we go out.  I want to have an apartment by the beach that you love to go to.  I want to be the reason you smile in the morning and the reason you can peacefully sleep every night.  I want to be your confidant, the person you can tell anything without fear of judgement.  I want to be the person you explore the world with.  I want to learn from you and I want to be able to teach you as well.  I dont want to be perfect but I do want you to be able to correct me when Im wrong and help me to be a better man.  You make me want to be a better man.  I dont want to lie to you ever again.  I want to be someone you love enough to forgive.  I want to wake up next to you every morning and enjoy the sweet smell of your hair.  I want to be the person that makes you feel loved all the time, giving you the compliments and affection you deserve.  I want to be the person that is your refuge from stress.  I want to be the best sex youve ever had and I want to fulfill all of your fantasies.  I want to get back on anti-depressants and anti-anxiety medication so you dont have to deal with me ever being unstable.  Honestly, that might also have something to do with the better sex thing as well.  I want to go to shows with you.  I want to ride bikes with you.  I want to share music with each other.  I want to be your everything.\n\nMost of all, I want to be opiate-free.  You said it didnt necessarily bother you that I was using dope in the incident that provoked you to want to chill on us for a while.  Perhaps thats true but I dont want something as stupid as drugs to ever be a point of contention between us.  I dont want anything at all to be a point of contention between us.  I dont want anything in my life that makes me ashamed of who I am and makes you ashamed of the decisions I make.  I want to make decisions that make you proud and I want to be someone who is a constant source of joy in your life.  I told you this already but the decision between getting high and being with you is an easy one for me.  Perhaps its a decision you arent even asking of me.  Thats ok.  I want to make it for myself.  I want you to know that you can safely invest yourself in me emotionally without worrying about my life being at risk or worrying whether Im lying to hide embarrassment or shame.  You are better than any drug.   \n\nA few weeks ago, you told me you love me.  Those were words I have waited so long to hear, and to hear them from you was the most fantastic gift I could ever imagine.  I immediately said it back to you because I had known I felt that way for a while.  Perhaps the fact that it happened so fast played a factor in you wanting to hit the brakes.  I understand that, but I also hope that doesnt make it any less true.  I hope that it at least means you wont forget me and that I still have a chance to achieve all of the goals Ive listed.  I dont want to bother you while I get my life together, but I hope more than anything we can start anew a little bit down the road and we can build our relationship stronger than it could have been without this wake up call.  I have cried and cried over the fear that my chance with you may be gone but I am determined to be the man you deserve if youll let me.  """
3r8o9c,gr8fulwil,11/2/2015 12:23:22,b'45$ for a 60mg opana?',"b'is this a decent price? im in the southeast, i only know oxy hydro and h prices really. THanks.'"
3r8gvm,felpz123,11/2/2015 11:38:08,b'Hydros or heroin?',"b""I can get 4 hydro 10's for $20 or a half point of heron... hydros last longer for me, and I like the high better, but I won't get as high. WWYD guys?"""
3r88d9,Ifuckeduppppp,11/2/2015 10:45:49,b'Inknow this is the wrong subreddit for this but maybe you could help. I buy etiz powder in pure powder and mix myself.',"b""What would happen if I check myself into the hospital and tell them a buddy has been giving me etizolam (which is techniqually legal) and I want a taper plan (maybe Valium?) to stay off benzos forever EXCEPT when needed. Because I am prescribed alprazolam. And do you think they would hold me at all? Cause I really can't afford that.\n\nOr do you think i should go to my doctor and explain the situation and see if he can get me on a long Valium taper so there's no way the hospital could hold me. I just want out of this evil drug. """
3r85qc,svene,11/2/2015 10:28:29,b'Rant about friend/Narcan?',"b""Hi guys,\n\nSo I have this friend.  He did Roxies(to my knowledge.) every other week.  We move in together, he started hanging out with my two other friends who were former heavy dope users, but now are current heavy dope users together.  Insert my friend who I live with.  Shot dope for the first time a few weeks ago.  now is shooting somewhat regularly.  I'm trying to tell him to slow down, He shot had a OD with some other people and they had to give him CPR.  Just a bit stressed about the entire thing.  I care about him and it is making me sad to see him turning up the speed SO fast, or it seems to me anyway.  Any ideas or words of wisdom I should get now instead of learning later?\n\nI I have also suggested I can get him to see my therapist, but he has been soso on the idea. The facility does drug council and depression/anxiety counseling. \n\nHow can I get Narcan?  I live in less populated state so keep that in mind."""
3r82td,Thatguyonheroin,11/2/2015 10:09:37,b'North Texas powder!!',"b'So usually in the DFW area all there is to find is BTH. Lately the last few months, my D-Boy has had the options of pow or tar. The shit last night I got from him was that grey dope, extremely good!!!\n\nAnyone else in He metrorplex of DFW been getting pow?'"
3r7qol,rmiller2029,11/2/2015 8:44:38,b'So house arrest locked me up',"b""But I'm back baby! Tearin  Louisville up! Wonder how high these 2 .2s will get me?"""
3r7m7a,Dopana,11/2/2015 8:08:29,"b""It's a beautiful morning. Let's talk!""","b""Stocked on dope, stocked on etizolam (don't worry, I sniff and use **very** small doses) and called off work today to study all day for my midterm. Needless to say, it's a beautiful day so send me a message or comment if you wana talk ! As always, happy nods:)"""
3r77ih,theBLUEbomber_roxman,11/2/2015 5:38:13,b'Stupid daylights saving time',"b'Im one of the worst miserable ppl first thing in the morning from the second my eyes open till my caffeine fix.Ok so i wake up at 640 per usual snoozed til 650 (i keep my clock intentionally ahead cause im always late ). Look outside its dark as shit,im like hm. start rushing cause i think im gonna be late cause i gotta go pick my boy up. See the cable box, says 5:43. FML. Its impossible for me to sleep once thay happens.so might as well use this time wisely. So im doing what any self respecting junkie would do. Im gonna use this extra time to do drugs!!without having to rush like usual.awesomness.\n\nAnyone else get screwed over/forgot dls time?'"
3r70gj,whereismymayo,11/2/2015 4:02:03,b'Limbs falling asleep in nods',"b""So my arm fell asleep earlier today for a good 2 hour mini suboxone nod-nap thingy cause I took a little too much than usual. My bicep hurts to extend all the way now. . . When will it go away? I've read bad shit about people having their limbs amputated, and honestly am kinda shocked it was so bad this time, when on dope I've nodded out in the worst positions I'd imagine for this and my whole entire arm so limp and dead tingly I couldn't move it for 30+ minutes whatsoever, it just limped around like it was dead. Really scary how it hasn't gone away yet, and this was just from some sub's . . . . Anyone?"""
3r6pna,opiatequestionhear,11/2/2015 1:32:39,"b""Ears feeling very 'sensitive' to noise after using opioid for a while""","b""I know that people have sometimes had major sudden hearing loss from use of opioids, and so I'm concerned. I've been taking 200-400 miligrams of tramadol everyday for around 1.5 months, and in the last week my ears have been feeling really sensitive to any kind of loud noise (especially percussion type noise in music). I don't have any hearing loss at all, it's just this sensitivity to most loud noises (and it feels like me ears kinda twitch when I hear a loud noise).\n\nDoes this sound like something I should be worried about (like is it a sign of impending opiate-induced deafness?) or is this just a common effect? I know tramadol isn't the best opioid out there but it helps me feel happy all day. Would switching to a different one maybe be better for this?"""
3r6nzj,naggle_kin,11/2/2015 1:12:57,b'So my bags got a little damp',"b""They're not totally destroyed but I've been in situations where they got soaked and they were unsalvageable(My period and question mark buttons aren't working, so bear with me, I'll use semicolons for periods); Does anyone have any suggestions to dry them out and get my bags back to normal(question mark) By the way, I use my nose; oh, and this is the kind of dope that comes in stamped glassine that one acquires on the east coast;\n\nTotally unnecessary backstory(and boring!): On my walk to my brother's house I had to pass through the local high school; Its an excellent shortcut; I've had my pockets run by the fuzz walking through there at night before; I didn't want to take any chances by leaving them in my cigarette pack so I put them in the cellophane, sealed it up, and put em' in my sock; Sure enough, I ran into some cops; Happily, they stayed in their car and merely inquired about my health and advised me not to break into the high school; Nice fellas; Well, I guess I didn't properly seal it, because when I pulled them out later they had gotten a bit damp, from the sweat, I suppose; Now, on this occasion they are not totally fucked, but it would be nice if got them back to normal; It is a heart-sinking, soul-crushing, world-ending moment you pull your bags out of your pocket and they're totally soaked;\n\nThanks for the help; even if you don't have any; (Does anyone have advice about how to fix a keyboard[question mark])"""
3r6nbf,UpnDownLife,11/2/2015 1:05:32,b'Australian OTC Opiate Combo; Whoa.',"b'Hey everyone, obligatory (Long time lurker, small time poster.) Although i did comment very regularly back 2-3 years ago. \n\n\nSo i\'m from Australia; the land of over priced drugs. And was a dope / Oxy addict for a good 3 years. I\'ve currently been on Methadone / Suboxone and now again Methadone the last 2 an\' half years. I was on 80mg and have my made my way down to 10mg. Yay nearly off, So i\'m at the point where i can start chipping again.\n\nBut our heroin is very very expensive; approx $150 for a ""Quart"" (2.5 points) and the purity is probably less then in the US. \n\nBut our chemists are very generous with OTC opiates. \n\nSo i strolled down to local chemist and picked up the following items:\n1 x Bottle of DXM Syrup\n1 x Pack of 25mg Promethazine\n1 x 40 pack of 15mg Codeine / 500mg APAP\n1 x Bottle Of Rikodiene 200ml (Contains 380mg Of Dihydrocodeine and A LOT OF sorbitol which can cause a literally pissing out of your ass. aha )\n\nSo my combination went as followed;\nT+0 Took, 30mg of DXM and 25mg of Promethazine\nT+35 Took 400mg of CWE\'d Codeine \nT+1h5 Ingested 380mg of Dihydrocodeine \n\nI have to say the high is fucking excellent, I was nodding hard and the body high was really strong, along with the euphoria. Comparable to say 60-80mg of Oxy although very different high.\n\n The promethazine also got rid of that irritating histamine reaction that comes along with the codeine. \n\nthe codeine clogs you up enough to counteract the effects of the sorbitol. so no explosive diarrhea and no constipation. \n\nOverall a fantastic experience for all OTC supply\'s. \n\n\n\n\n\n\n\n\n\n\n\n\n\n'"
3r6ir5,shaegray,11/2/2015 0:14:13,"b'well, im trying to quit again'","b'yet again the quitting commences alcohol and valium for the next 2 days then nothing from there, wish me luck family, im day  1 and im in hell '"
3r6in7,JaneSeys,11/2/2015 0:12:54,"b""When you can't sleep, because...""","b'Fill in the blank. Preferably opiate-related causes. Atm my lack of sleep is caused by me obsessing over my morning bag. How good it\'s going to be, and how I\'d rather just do that fat blast rightthefucknow. ""BUT DADDY, I WANT IT NOW!""'"
3r6f6d,aaron62691,11/1/2015 23:38:06,b'Shoving a pill up your ass...',"b""I know plugging is great and all. I enjoy it myself every now and then. But have any of you ever just shoved a pill up in there and let it chill out and dissolve throughout the day? Like pop a couple down the windpipe, and shove one up the poop shoot. Sounds like it'd be pretty awesome. The ones you eat would obviously be the ones to come on first and then the one up your ass would bring up the rear. """
3r64q1,Smokedsmoker91,11/1/2015 22:03:10,b'To /u/badass_bitch',"b""Thank you for your post earlier with your real dope porn! You are extremely banging (along with beautiful and would love to see your face). This is not intended to be a creeper stalker post, I just wanted to express my thanks to you. I'm sorry if I have crossed any lines or made you feel uncomfortable in any sort of way if I have please let me know and I will personally remove this post.\n\n\n*edit* \n\nI love that this post blew up and not a single up vote...you guys are bastards! Lol jk couldn't care less I love you all """
3r61ko,fluffydreamz,11/1/2015 21:37:09,"b'Well, I tried coke again for the 3rd time and...'","b""Nothing! :(\n\nI tried it twice before and told it was decent, but not the best. I took quite a bit and all it did was make me throw up and numbed my face. No energy, no euphoria. The second time I did it, I even made sure to wait a long time after using an opiate so the two didn't mix (like over 12 hours) and still nothing.\n\nSo the third time I tried, I was told this is the best stuff around(all my friends said it was the best they've ever had as well), and I waited a long time after consuming an opiate to use it and still nothing. My face is just numb and all I can taste is blah. \n\nAnyone else experience this? Every other stim seems to work except this. *Sigh* Oh well!!"""
