Post Id,Author,Time,Title,Text
3lwk93,GettinDrunkWithJesus,9/22/2015 0:48:18,b'let the good times roll',"b'Let the good times roll...\n\nThe story has been written before and it will be written again. We want to do things that feel good. Is that a crime? I don\'t have the philosophy degree or patience to argue either side of that. I\'m just a victim of it. A victim of my own nature. A nature I, in the very least, share with others. \n\nWhether commiserating on a midnight run to the block or in the stuffy side-room of a church at least this condition brings the occasional good conversation. Mostly the former, but I occasionally catch some good stuff at NA meetings in whatever time is left between the the ridiculously repetitive readings. 12 steps. 12 traditions. Printed out and laminated by some poor old crackhead trying her hardest and passed around infinitely by the same hands that once handled ounces of meth, stolen guns, and strange cocks. Read in a voice that varies from the enthusiastic, i\'ve-found-god (and think you should too) voice, to the possibly illiterate drawn out recital that garners encouragement from the recovery bro\'s in front. It\'s surely made people more patient than me take 12 steps out the door and into their grave. It\'s all just so *supportive*. Can\'t fault anyone for that. Maybe Adam for not listening to God and pissing him off enough to create us and the things we enjoy to death. The rest is already written. \n\n""We DO recover"" and the reader scans the room with an eyebrow raised. It\'s gone from annoying to routine and back to annoying. In short, i\'m fucked by their definition of the word. \n\nI take a sip of my black coffee and try to relax. My leg shakes up and down. I\'m trying. Really trying. Doing everything I should be doing but... But what? There shouldn\'t be a but. BUT there is. Clawing at my stomach telling me to go. Telling me to leave. Telling me if this fuckhead would just shut up about his sickness of obsession with the girl who half-heartily serves his coffee I could MAYBE focus and have one of these spiritual realizations everyone keeps talking about. I thought I had one the other day. Two birds flew up to me and stared right at me while I sat down to eat a $3 pre-made sandwich from Safeway. I thought maybe it was them. The gone. Re-incarnated to tell me everything was ok. That I would be OK and I am protected. I opened my Sandwich and realized they had, characteristically, forgotten to include the tiny Mayonnaise packet that makes it edible, leaving me with a bone dry pile of garbage. How easily my Nirvana is swayed.  \n\nA happy ending for us would be the best gift in the world. Where we all get what we deserve and don\'t leave a trail of tears behind our caskets. He did what he had to do, fixed himself up, dusted himself off and got right. But it doesn\'t work like that, not in this world. And the overly friendly guys who corner me after the meeting know that. They are like me, just operating on some kind of higher frequency that allows them to accept the bad things and not think it\'s all bullshit. Or they put on a hell of a mask and are secretly unsure that this, or anything else, will be able to cure the hurt and damage done. It\'s a few of the same of the borderline confrontational phrases used to distill our entire psychology into a sentence so we can digest it and and repeat it when some of us inevitably disappear. They are not far off in their definitions and platitudes. But trying to understand addiction is like chasing the wind. And in an addicts mind the truth is blurred and undecided, only to be reveled by the series of split-second decisions that will eventually determine our future. If a platitude carved into a block of wood ever got and kept someone sober I would surely like to meet him. Shake his hand and admire his single-mindedness. \n\n""if you change NOTHING then NOTHING CHANGES"" I can imagine it now.\n\nWith all the resources we have we still can\'t figure out how to stop addicts from killing ourselves. If it wasn\'t so tragic, it would be comical. I sometimes think about an animal doing it. A heard of deer, one after one, following each other into an electric fence and being fried by the current. It would probably get a lot of view on youtube i\'d wager. But when it\'s me I expect some unobtainable and undeserved level of empathy. I\'m the victim and the perpetrator rolled into one, trying to quell my nature for long enough to make it home safe tonight. Tomorrow is just another unknown.\n \nMaybe he\'ll take over again tomorrow and try to kill me. Because fun. Fun. Nothingness is fun. Feelings are not fun. And is it such a crime to have a little fun when you\'ve done so well recently? Is it? Because I really don\'t know. Why does this have to be so serious? Let it be formally known I don\'t think the punishment fits the crime. The idea that I can either stand up, introduce myself as an addict and work within this paradigm like a broken horse or walk outside and die. Well THAT doesn\'t seem fair. But i\'m just an observer sitting in this chair with no power besides a hope and a prayer. Let it roll I guess. \n'"
3lwj1e,thatversionof,9/22/2015 0:34:29,b'Hi',b':('
3lwdpy,cannablissy,9/21/2015 23:38:02,b'Question about dosing;',"b'Hey fam, just a quick question that I may even end up answering on my own, but just want some verification to make sure I understand,\n\nI usually take 60mg oxy a day, all at once. I did this yesterday, then about 6-7 hours later I took 45mg oxy, but literally felt no effects. I\'m not even sure my high was maintained at this point, I felt no nod, little euphoria, etc.\n\nMy question is, was this because I\'m used to a 60mg dosing, & when I did 45mg it didn\'t stack on to the 60mg I had in my system, but rather just acted as a method to ""maintain"" the current high I had going? They say take every 4-6 hours but I was probably at the 7 hour mark if I\'m being real, so maybe there wasn\'t anything left to maintain? \n\nJust trying to figure out if it\'s tolerance issues or dosing issues. In my mind, 105mg in one day might be the most I\'ve done in a while, but if it was spread out at 60mg and 45mg, it wouldn\'t be like taking 105mg at once, correct? \n\nSorry if this is common science, I\'ve just never not had any effect happen to me in a while, lmao. I just took 30mg today, at once, & felt better but not euphoric for obvious reasons, so I feel like I should have felt that 45mg dosing regardless. \n\nThanks for any insight!'"
3lwcy5,IntoTheWild_,9/21/2015 23:30:30,b'Why am I such a baby with this?',"b""Let me preface by saying I don't use. Anyway I had eye surgery and then nicked the tip of my fibula a week later and xray showed a hairline fracture. Anyway I got 20 percoset a for both (40 total) 20 5's and 20 7.5's. I take a 7.5 and vomit for like an hour straight. Today I took half and I still got sick. I don't get it... What can I do? The pain is brutal and I literally want to cut my foot off but I don't want to be sick all day. I know I'm a big baby but I've probably been crying 20 hours of the last 24. \nEdit to add: I was prescribed promethazine to counter act the nausea which didn't do jack shit. Ugh."""
3lwb64,Remembr_When,9/21/2015 23:13:20,b'Ugh',"b'I\'ve been decent with not selling my shit in the past, always good with hustling and getting others to provide my high one way or another. And now I\'m presented with the opportunity to sell something, and I literally just got a new job today after being out of one for a few weeks. I WANNA GET HIGH SO BADLY. I\'m glad I don\'t get sick anymore, a couple rounds in rehab and I\'m a little better with control for now. But holy fuck I\'m so close to ""sell everything"" mode. Thank god I\'m not on benzos. Or fuck, why aren\'t I on benzos? This conflict sucks. Total first world junkie problem but I hate it honestly'"
3lw7ls,Drowzeyy,9/21/2015 22:41:15,b'Life Is Never Enough',"b'It\'s been about three months since the last time I did heroin. All the time I was using I remember thinking, ""I just want to go back to normal life, get all my old friends, enjoy the little things etc."" The truth is, since I\'ve been clean none of this is enough. I still think about using everyday and I know it\'s inevitable when I go and visit my hometown, where all of my connects are. I\'m finally in college doing normal things with normal people which is what I always wanted to go back to, but it will never be the same. I feel like I\'ll never be satisfied and I\'m destined to live the short, disappointing life of a young addict. But at the same time, it seems like a worthy sacrifice for that feeling I\'ve been chasing since that first taste. It\'s a really weird limbo that I wish none of us had to experience.'"
3lw7ak,DarkNetDyes,9/21/2015 22:38:29,b'It feels so good to go bad',"b""Half a gram of tar on it's way through the post and about to smoke my first cigarette in months, why must it always feel this good to do this bad? On the other hand, how would you guys suggest I do my tar, I used to be an avid #4 user but always wanted to try the sticky icky black stuff"""
3lw3yl,djdubyah,9/21/2015 22:10:22,b'Junkie Jesus is real!',"b'Friday night is bowling night. Problem is I\'m on the wrong side of 7 days sober. The shitting and the shivers have already abated just caught feeling like garbage.  Sore, tired, depressed. I flop in my chair and guy from team we bowlng comes over to shoot the shit. ""Hey, jesus you pale, drink too much last night?"" Followed by a belly deep laugh of hearty good-naturedness.  ""Naw, slept like shit, shoulder killing me, good for you guys, bet I bowl like shit""  Indeed, the thought of hurling a 16 pound ball 30 + times over the next two hours is starting to sound more and more like a really bad idea. \n""Really? Uh, hold on"" he takes off and rummages in his bowling bag, I think to offer me a motrin or other such garbage.  He comes back shaking a brown RX bottle.  ""You want these? Were for my knee surgury, they make me dizzy, so be careful if you never had one.""  Jesus wept.  http://imgur.com/zNwHJRl thank you junkie jesus for working thru this man! I bowled a 633 series and had an amazing night! '"
3lw37p,chanchan69,9/21/2015 22:04:03,b'Junk chronicles part 1: intro/ramblings',"b'Junk chronicles part 1\n\nHere I am lying in bed at my grandparents house. In a similar position as I was a little over a year ago. My mind is slowly coming back to me. Enough at least to where I can no longer ask myself ""How did I get here?"" I know damn well how I got to this point and I know I did it all to myself. Maybe I had a little help along the way. Enablers come and go. But in the end no one forces us to smoke that blunt, to sniff that line, and they sure as hell don\'t force the needle into our veins. That wasn\'t my experience at least. \n\nThis last binge has been one of the longest and hardest I have put my body and mind through. I know I can\'t keep doing this to myself. So why then do I continue down the path to self destruction? I can make excuses till I\'m blue in the face but in the end getting high is just easier. It\'s easier than coming to terms with the fact that I have a problem that I just continue to let grow and fester like an oozing abscess. It\'s easier than staring into the cold blue eyes of that demon which mimics my every move. It\'s easier than watching my mother break down in tears for the hundredth time begging me to just make her understand the reasons behind it all.\n\nI had it all. The world at my fingertips begging for me to take it by the reins. And I pissed it all away. I made the decisions that have made me who I am today. And I wouldn\'t trade all the dope in the world for the life experiences I have gained along the way. But I still have regrets.\n\nPlease feel free to leave feedback good or bad. I hope you guys find this somewhat worth the time to read. I haven\'t written this much in a few years. It\'s rough and it was supposed to be more upbeat. But it\'s something I needed to get off my chest. I have so many stories that I want to write about that are more upbeat and ones that will make you cringe and wanna cry and just ask why the fuck does he keep doing this!? But I\'m nodding on my suboxone right meow and need some sleep. '"
3lw1v6,highlowyesno,9/21/2015 21:53:01,b'Warning: Debby downer (no pun intended)',"b""Hi guys, I just need to bitch and complain for a minuet, and I have not a friend in the world, and my boyfriend is being a selfish and immature fucktard. I am just so sick of being so fucking alone. Noone knows that I use opiates, and it's nobodys goddamn business as far as im concerned, but I wish I could just be honest with someone about it, but honestly, being treated this way is the type of shit that makes me justify using and keeping it to myself. It's all an ugly fucking cycle. \n\nI guess that's it. I just needed to vent in a really general way. I hope everyone else's night is going better than mine. \n\n"""
3lw106,benzopiate,9/21/2015 21:45:54,b'Best stash spot?',"b""Inside the house, car, w/e. What's your best stash spot? Outlet stashes? Fake aerosols? Etc. What's your go-to?"""
3lvzf8,The_nodfather,9/21/2015 21:33:10,b'In regards to shipping gear.',"b'I made an edit at the top of [this post]( http://www.reddit.com/r/opiates/comments/3lqkef/i_have_access_to_free_rigs_free_narcan_for_the/) stating that Narcan was in limited supply for our area, so I can no longer supply anyone with that.        \nI can get access to a little bit, but sadly I cannot help everyone on here with Narcan.         *****\n           \nI can help you get cleans.        \n1/2"" 28 gauge 1ml packs of 10      \n1/4"" 30? Gauge 1ml packs of 10          \n\n1"" 25 gauge 3ml single rigs     \nAlcohol pads          \n          \nIf you need any of those, I can ship that. **NO NARCAN**'"
3lvy7m,FromWombToGrave,9/21/2015 21:23:56,b'Klonz and ambien question....',"b'What\'s the best way to get good off 1 milligram k-pins? They have the letter  ""R"" and number 34 stamped into them. I have not tolerance to benzos, and have been taking up to 2 sublingual li and have also ate them. But they seem weak and that have a long half-life. Any info would be appreciated thanks.'"
3lvvcm,Lezzbian,9/21/2015 21:01:23,b'The beloved OxyContin',"b""I'm prescribed 20mg of OxyContin even 12 hours but they seem to wear off in 6 hours. Would it be bad it I took it every 6 hours? Or better yet every 8-9 hours? Every 6 hours seems a bit much for me.\n\nBackground: I do have a tolerance to opiates. I've been on Percocet and Vicodin off and on for about a year and a half. Took 4mg dilaudid 4 times a day for 9 months and now I'm prescribed OxyContin. I try to be careful with the dosage because even though I do have a tolerance, I still have a fear of OD. So I try to be as careful as possible. I do take it for an actual pain condition, it's not really recreational. Anyways, let me know your experience with this OxyContin.\n\nSide note: I know y'all are not doctors and just asking for experiences not medical advice. I thought I would get that out of the way."""
3lvpgm,Alt_Small_Man,9/21/2015 20:15:22,b'What is baclofen? Is it worth taking a couple to catch a buzz?',"b""I've googled around a bit in the subject, but I can't find the info I'm wanting - which is this: is baclofen worth taking/can you catch a buzz from it? """
3lvpb2,Gudfeels31,9/21/2015 20:14:08,b'A Rare sighting...',b'Fire stamps in the South. Better chances of seeing Sasquatch in the swamp !\n\nhttp://imgur.com/Jk1Z9Px'
3lvm3v,retoxtom,9/21/2015 19:49:26,b'Milky white when mixed',"b""So I been doing clonazolam and 1 mg of sub a day for a while now. Decided to treat myself and picked up a quarter g. I looks and smells like fire but my buddy mixed his and it turned like milk white. What am I working with?\n\nEdit: I'll try to get a pic soon. It's hard living with mom"""
3lvjwg,Google_Fiend,9/21/2015 19:32:32,"b""Here's to a humble hero that doesn't get the respect it deserves . Kratom. Anyone else have love for this stuff?""","b""When my stash is low and I can't get more for a while, Kratom is always there.\n\nWebsites always carry it. It's never hard to get. It helps withdraw symptoms like nothing else I've had. Kratom always has my back. \n\nAnyone else want to say a few words about how they feel about this stuff, good or bad?"""
3lvii4,TreeRillo,9/21/2015 19:21:57,b'I love when f.lux kicks in while nodding!',b'The screen gets all dim and it makes me feel warm inside. Especially with 90mg of morphine up my ass lol '
3lvgzd,drbea,9/21/2015 19:09:53,b'That moment when..',"b'You finally got a little cash for dope, then you gotta wait for your guy to get off work :v hopefully should be soon!'"
3lve75,superdownvotemaster,9/21/2015 18:49:46,b'To peeps posting pill porn...',"b""Aren't you worried about getting caught somehow? I'm not tech savvy at all but I know for sure that cops (and worse) lurk here. Do you always create a throw away for it? Even still, they could trace you through that I would think..."""
3lvcga,logman360,9/21/2015 18:36:55,b'experience: snorting methadone powder',"b'so what i did is did a CWE on five 10 mg pills of methadone, using about 50 ML. I then let it evaporate under the hot sun until I got it down to straight up powder. I scraped all of it out and railed 1/5 of it, about a 10-13 mg line. it had a far faster effect and hit harder. within 10, 20 minutes I got a very nice rush with little to no burning like snorting the pills. Then I railed another 1/5 so i was up to probably 20-25 mg now. the rush was intense and it hard so hard that the euphoria was greaaat. i much prefer this method to oral. gonna try to plug the rest of the powder after i make it into a little solution. will update.\n\ntldr: snorted pure methadone powder evaporated from cwe, no burn, rushing in 10 or 20 min, same duration, more euphoric and harder hitting, it actually gives a nice rush and peaks much quicker than oral. gonna try pluggin powder now.'"
3lvazn,49ersFan80,9/21/2015 18:26:07,b'Does anyone have any experience dropping their tolerance with naltrexone or narcan?',"b'Hello Friends~\n\nI was curious if anyone has any experience taking (just) naltrexone or narcan to help temporarily reset opiate tolerances? I\'m specifically referring to ""regular doses"" of antagonists on their own, as opposed ""microdoses"" being administered simultaneously. A handful of anecdotes I\'ve seen on boards, in addition to some very limited published research, are indicating that this may work. Basically I\'ve heard/read that taking regular dose narcan or naltrexone drastically lowers your opiate tolerance ""for a week or two"", but you have to be really careful dosing as you can OD if you don\'t respect the marked tolerance drop.  \n\nDoes anyone have any experience with this? How much did your tolerance drop? Here\'s a summary of one of the limited published instances of this working, but there are *not* multiple published papers to back this up:\n\nhttp://updates.pain-topics.org/2010/11/naloxone-reboots-opioid-pain-relief.html'"
3lv7e4,Tar-King,9/21/2015 17:59:34,b'Tar Porn',"b""2G of Vacaville's finest\nhttp://i.imgur.com/r5FQ11g.jpg"""
3lv4f3,ShitLordJnr,9/21/2015 17:37:32,"b'Oops, codeine and alc mix'","b'Just had 60mg codeine, an hour later had a vodka, sharp pains in kidneys and my hearts pounding. Damn!'"
3lv26g,cornflaskes,9/21/2015 17:21:20,b'I wanna quit heroin but my friend keeps giving me free heroin',"b'it was cool at first but now after a few montyhs of heavy use Im not finding any joy in this drug and I want to stop but then Im offered it for free all the time from my good friend whom is also a big middleman\n\ni hate heroin, but at least it makes work bearable'"
3lv1sq,The_former_opifiendd,9/21/2015 17:18:52,b'D-Boy Dog House',"b'Today I hung out with an old friend of mine C, who I haven\'t seen in a month. I am a chipper who snorts while C is a full-blown addict who shoots. For a long time, C would help me get dope, but always middle. I would always hook her up well, but obviously I would prefer a real connect and I tried to make this known to her. I went out of town for the summer and last saw her when I came back at the beginning of August. I asked her if she could help me get a g. C offered to do me one better. She\'d introduce me to her connect in exchange for .2. I was perfectly happy to do this as that\'s probably what I would\'ve given her anyway. When we met B, he hooked C up with a free g for the new customer. They seemed very chill with one another, and it was good dope.\n\nI continued to cop from him through penultimate week of August, then stopped. One of these times we talked for like 10 minutes and he mentioned how he and C were pretty good friends. I haven\'t done dope since then. I have hit him up twice in the last 3 weeks but he has not responded at all. \n\n\nWell today I finally got B\'s new number and texted him to see if I could get a g today. He texts back a half hour later or so saying yeah, but I have to go get a new phone so I tell him I\'ll be a while. Fucking AT&T store ends up being like a $15 uber ride away and takes them an hour to exchange my phone. C texts me and tells me she can get better dope than B has for the same price and she could pick me up from where I was. This sounds good to me so she comes and gets me and we cop. On the way she is telling me that B hasn\'t been answering calls from her all morning and when I mentioned he had texted me she is peeved. She tries to call him again but he doesn\'t answer. I think she thought her phone was maybe fucking up, so she asked if she could use mine. I call B and when he picks up I tell him ""one second"" and hand the phone to her. She starts talking to him and it quickly becomes clear that he was avoiding her phone calls because he\'s pissed at her over a car which he bought from her recently which has some issue that just came to light and is getting mad at her over piddling amounts of money he said he\'d pay her related to the car, like $50 or something. C was calm and wasn\'t yelling or acting hostile she was really just confused as to why he was mad.\n\n\nWhen they finally get off the phone I immediately text B and apologize for giving her the phone as I had no idea they had any kind of disagreement. He texts me back telling me ""he ain\'t ones to play games wit"". I honestly don\'t care if I lose him as a connect because apparently he cuts with brown sugar now and I\'m not interested in that. But still feel like I kinda got fucked over being in the middle here. Like I didn\'t do shit but still get fucked out of a connect. For letting someone use my phone... Oh well. I\'m high.'"
3luywe,whereismymayo,9/21/2015 16:58:34,b'I got from 5-6 mg of sub to 1.5 -2 mg of sub in like a week with phenibut',"b""Couldn't do it before after attempting and failing over and over again dropping my dose without it..for months. Got some phenibut a couple weeks ago and i just picked up my 2mg strips today. It was *easy* dropping that low and it never was before. The pheni made me completely forget to actually dose my sub the first 3 days I felt so good lol. I just gotta be careful with this shit...its really addicting and I'm starting to see why now that its been a month on it every day. Welp. Least its legal"""
3luypj,kingdom_of_loathing,9/21/2015 16:57:03,b'Toradol',"b""Have any of you had experience with Toradol?  Google hasn't told me much about any possible euphoric effects but there does seem to be a fair amount of side effects to it.  Is this worth picking up for a good price?"""
3lushm,DragonWithPants,9/21/2015 16:14:40,b'Any sports players?',"b""So as the title says so we have any ex/current athletes? I ask because I feel like I might be in the minority of being a athlete, with 10 years of football and 13 of baseball under my belt I was once a very athletic person which hasn't changed much other than I don't play as often anymore, I do coach little league baseball though so it's nice to see kids have passion for the game at such a young age."""
3luqi1,fluffydreamz,9/21/2015 16:01:11,"b'Alright, I need help.'","b""Okay, so I had some people do some very nasty shit to me at the beginning of summer and basically all my friends and family failed me. I pretty much isolated myself and became incredibly depressed, suicidal, and ultimately allowed my chipping habit to go insane. I started shooting up about 6 times a day. However over time, I've realized that I'm running low on cash (like most Junkies) and I have a couple options: I could kill myself or get clean. \n\nObviously I decided to get clean, but the idea of killing myself is always lingering. Anyways, I tapered myself down to 2 shots a day, but I can't seem to get off from that without shitty withdrawal.\n\nAt this point I've decided that I'm just going to kinda dive into withdrawal and get it over with. So far in terms of supplies I've got weed, a few benzos, and phenibut. What else would you guys suggest? I've heard a lot of positive things about lope but I don't have a costco membership and it's pretty pricy here in Canada.\n\nAnything else I should add? And what should I expect? How long should it last?\nThanks guys, you're all so wonderful and your positive words have always kept me going. I love you all so much! <3"""
