Post Id,Author,Time,Title,Text
3mv17m,gimmieops,9/29/2015 13:05:41,b'fucking detox. finally out..',"b'just got out of detox. got ""marchman acted"" thursday night and just got out today. shitty, the detox was awful and shitty.. especially detoxing in probably the worst facility ever, but hey i\'m clean now i guess? my friend squirted a little too much liquid xanax into my mouth (probably around 20-30mg) and i took two shots of captain and shot about 4mg of dilly and completely blacked out.. next thing i remember is its daytime now and i\'m walking out of the house... this dumb cunt is accusing my girlfriend of stealing makeup from her (which she did not) and then after trying to hit my girl and shit which wasn\'t ok... i broke them apart so she runs in the house and tells her boyfriend or brother, i can\'t even remember i blacked out again, that i hit her. i remember getting kicked in the face sort of hard to do anything when everything just keeps going black, lol. next thing i remember.. cops. they found a needle on me and let me go and even brought me back to my house. i don\'t remember what happened, blacked out again and then next thing you know i\'m waking up to cops hovering over me placing me in handcuffs. they take my pills and my needle and set it in the bed and let me keep them and brought me to the facility. end of story, here i am. i\'m pretty anxious and uncomfortable right now my family isn\'t exactly helping me out right now and i dunno, i kinda want to get high. my exciting week..'"
3mutg9,ObviousReminder,9/29/2015 12:15:17,"b'You guys warned me, yet I still shat on your advice. Thought I was different than anyone else, that arrogance ended with addiction.'","b'2 years ago I posted my very first thread on /r/opiates\n\nIt was a question regarding some 7.5mg percs that I stumbled across. Up until that time, I had never taken an opiate in my life (I was 22 years old then) not even a little script from the hospital for a tooth ache or something, nada. I explained my situation in the thread saying that I just tried my first taste of opiates and how much I fell in love with the high from the very first taste. Back then, I took two 7.5\'s for a whopping total of 15mg (lol) I was literally floored I was so damn high, I thought to myself this is wonderful.\n\nYou guys desperately warned me to quit now while I was ahead. I told you all ""nahh, I can moderate my use, I \'ll just do it once or twice a month as a \'treat\' and no more"" all of you guys kept saying ""EVERYONE SAYS THE SAME THING"" but my dumbass thought I was special and had more willpower than others.. oh how wrong and foolish I was\n\nFF 2 years and here I am on a 80mg/day Oxy habit, while I still haven\'t \'upgraded\' to the needle or even Heroin for that matter, my first thread here and what you guys told and warned me is a constant reminder about how easily it is to tell yourself you\'ll behave and how easily it is to not behave, so I\'m not cocky anymore regarding my willpower, I must always remain vigilant in this game we play. I know that just because I tell myself that I won\'t use H today, doesn\'t mean I won\'t have a needle in my arm a year from now. My humbleness towards opiates has risen drastically.\n\nAnyway, the point of this thread is hopefully reach people who are just beginning to use opiates and maybe have the same attitude I did 2 years ago. You are not special man, the opiates will always win, no matter how careful you are. Moderation does not exist long term with opiates, it truly is all or nothing (granted, you can \'chip\' successfully for a few months, but in the end the dope or pill will always win, you\'ll slowly start treating your \'chipping\' system with less and less respect and eventually fall hard again, it happens to everyone I promise)\n\nIf you\'ve done opiates a couple to a few times, please please please stop right now and never look back. It\'s really important you heed this advice. I know that once Pandora\'s box is opened, it\'s near impossible to close again, but you have an advantage over a lot of people as in you haven\'t developed a full blown addiction, you still have time to quit. Don\'t be like me and say you\'re different, I SAID THE SAME THING AND MEANT IT 100%.\n\nAnyway, enough preaching, just wanted to tell you guys you were right and I was totally wrong.\n\n'"
3musjr,MollyLucyAnna,9/29/2015 12:09:25,"b""I've been dating a heroin addict for about a year, yet he still lies to me every time he relapses.""","b""Just like the title says, I've been dating a heroin addict for a little over a year. We have been doing the long distance thing, so I haven't been able to be there all the time with him to help him if he needed it. His family doesn't know, and I'm one of the very few people who have stuck around for him after coming clean to his friends. But I have been completely supportive of him and his decisions. I just made it clear that I didn't want him to lie to me or keep his use from me.\n\nUnfortunately, he has lied constantly to me for this past year. Even though I have witnessed him smoke, gone to pick some up with him, and even separated the heroin into portions to help him wean off, he still chooses to lie to me. \n\nI've caught him in a lie around 6-7 times now, and we've had the same conversation each time. I explain to him that I love him even with his addiction, but I don't want to be lied to anymore. It has gotten to the point where I don't think I'll ever trust him again. And being in a relationship where there is no trust doesn't seem like a healthy relationship to me.\n\nEven though I was addicted to crack for two years, I, myself, am NOT an opiate user. So I know that I will never be able to fully understand what he's going through each time he decides to get clean. He says that he lies and hides things from me because he doesn't want to disappoint me, but I just wish he understood that he doesn't disappoint me when he relapses. He disappoints me when he hides it from me. \n\nHe told me about his addiction before we started dating, so I knew what I was getting myself into. I just didn't think there'd be so much lying....\n\nSo to sum this up, I am asking for advice from the Reddit community. After a whole year, I feel hopeless. I want to know where he's coming from. But I just get so frustrated whenever he lies to me. \n\nSeriously, what the hell do I do?!"""
3mtf1v,morbo2000,9/29/2015 5:15:10,b'Tracks: Volume 1 FREE to my friends',"b'Tracks: Volume 1 is done!  Thanks so much for all the love and support and positive vibes.  Reddit is my Muse.  Especially you r/opiates.  \n\nSo I want to give you the book.  Hell, it is OUR book.  Your voices are in here too.  \n\nRevamped stories mixed with new stories.\n\nI can make it free 9/29/15 and 9/30/15.  All I ask is you please Review it and share! \n\nI think some Reddit machines kill Amazon links so please to go my blog and get your Free book.  And THANKS!\n\nmorbo2000.com'"
3mtefz,I_Got_Yo_Pills,9/29/2015 5:07:14,"b""Not Opiates- but I know you're all very insightful about prescriptions, esp. Benzodiazepines.""","b'/post from /r/benzodiazepines \n*TL:DR below*\n\n\nTimeline :\nJune 2014- 2mg Ativan as needed for about 6 months \nDecember 2014- 0.5mg Xanax from GP, 30 a week till March 2015\n\nStart seeing Psychiatrist\nMarch 2015- 1mg twice daily \nMay 2015- 2mg twice daily \n\nSeptember 2015- starting to ween me off, \n1mg three times daily \n1 week later- 1mg two times daily \n\nNOW: \nAnxiety starting to come back, he has me on a weekly prescription basis (ex: 1mg Alprazolam 3 times daily, DO NOT FILL TILL 9/27/15)\n\nI was doing fine on the 2mg twice a day, some say that\'s too much but it was helping me tremendously. I do NOT want to go down to only 2mg TOTAL per day. \nI am having almost violent panic attacks, don\'t want to leave the house. Have no interest in friends or hanging out. \nGoing through the 1mg x14 like a fiend. Usually lasts me 1-3 days if I\'m smart with it. \nI don\'t abuse the drug or sell it however he is tapering me. \n\n*TL:DR - Doc dropped me from 120mg alprazolam a month to 60mg a month. Violently effecting me.*\n\nWhat do I need to say? I\'m already out from the ones filled this past Friday. These doctors must think I\'m abusing it, however I take as prescribed and it\'s really fucked me up.(*Edit: I realize that this isn\'t how it\'s ""prescribed"", however it\'s what my body is used to and needs)* \nI have no problem taking Xanax, and it doesn\'t scare me. I DO NOT CARE what ""the outcomes"" of long term use is. I see it as long as they are making the drug, why can\'t I use what helps me be a person. \n\nLong story even shorter: \n""What do I tell my doctor?"" And ""How can I convince him to keep me at either 3mg a day or 4mg a day?"" Or ""Should I ask him for Clonazepam instead?"" \n\n\nThank you for reading this, and any info would be helpful. \n\nExtra Details: 340lbs, 6\'3"", stressful job, 22 yrs - no Fedora \n\nPlease feel free to PM me or Post a reply below that isn\'t just calling me a retard for requesting these quantities. '"
3mt45m,opiathrowaway,9/29/2015 2:49:38,b'Anyone in Portland gone through Central City Concern? Hooper Detoz? The 8x8?',"b'Title is pretty self-explanatory. I\'ve ""hit rock bottom"" as the saying goes, and will soon be arriving homeless in Portland, OR. I\'m curious if anyone here has accessed any of [Central City Concern](http://www.centralcityconcern.org/services/health-recovery/hooper-detoxification-center/)\'s services and if they could tell me what the experience was like for them. \n\n\nOne of my best friends went through Hooper Detox and, after finishing detox, was immediately placed in a free sober living facility referred to as the ""8 by 8"" (slang, not actual name). At the 8x8 he went through a fairly standard intensive outpatient program, coupled with free Vivitrol shots. The 8x8 sounds like an old converted SRO, similar to where u/tracy415 stayed when she first got clean. I\'m curious if his path from Hooper straight in to housing is the norm with CCC or if he just got lucky... I\'ve heard some people get referred to a more intense program that\'s entirely inpatient. \n\nSo yeah, **TL;DR:** anyone in PDX go through treatment with CCC? What was it like? Thanks.'"
3mt30w,GreekLobsta,9/29/2015 2:33:46,b'Pulp Fiction',b'That part where Vincent buys dope and does a shot at his dealers house then drives off into the night smiling and smoking a cigarette was so juicy.'
3msz43,KrewTawns,9/29/2015 1:46:32,b'In rehab I learned a new slang word for meth. It really clicked today.',"b'""Ugly.""  It\'s popular with younger kids in the Mexican-American community, particularity ones who sell it and typically don\'t do it.\n\nThere\'s a zombie clown ""lady"" hitting on me, props to her though, she either has teeth or good dentures. Her husband is a complete pervert, coming from a guy who writes dirty erotic stories covering about a dozen fetishes. About half the stories are based in past events. And I think he\'s perverted, in a bad way.\n\nA close girl friend is picking the skin off her face next to a newer guy friend. He was really good looking, almost gorgeous 7 or 8 weeks ago. I wouldn\'t get with him if he killed the lights today. He had a nice chest with a 6 pack, and a slim but muscular build. Now he looks like he needs to be checked for muscular distrophy.\n\nI took a guys... Gay virginity the other night, with his wife. We got spun (I try not to shoot it lately), and his wife wanted to put makeup on me, and do my hair. The rest was a Friday night for me.. Pandora\'s box for them. I got dirty texts and had phone sex the next night. He apologized and asked if he\'s gay now the next. It just occurred to me, that his wife probably has no idea about the phone sex. I may be wrong on that, but it would explain excessive, unnecessary apologies on his part. I don\'t want to ask her..\n\nMy main meth dealer (I bought 1-3 points of meth a week, literally) is facing 36 years. He slept with a dudes girl, allegedly dude stole a truck and parked it in his driveway knowing he had reupped while spun out. He beat the fuck out of his literally 90lb toothless 22 year old diabetic girlfriend, who has some kind of chronic pneumonia. Some random chick caught him doing it, she literally knocked his teeth out in broad daylight. Cops let her split, him and his girl went to jail for spitting blood on cops. Except they didn\'t want to provide her medical care, she didn\'t even have insulin. They dropped her off at the ER. While bruised swollen and broke. Literally, it almost sounds nice except they were avoiding liability and medical costs. She bailed her boyfriend out the next day.\n\nLife is ugly on this side. I get perverted and sleep with too many different partners on it. Haven\'t heard I\'m ugly doing that though. I only regret one encounter. Have always used condoms, enjoyed myself, others enjoy it, and haven\'t knowingly helped anyone cheat.. \n\nBut they don\'t see the scars on their faces..\n\nThis is last week. I\'m pretty desensitized to this shit. At 16 I had my life threatened by my best friend suffering meth psychosis. It was at his 30+ y/o dealer/cooks house. A classmate was bound naked on his coffee table. I had tried meth two or three times by then. I recently found out my friends little sister was sleeping with him and his wife, after they shot her up with it. She was 14 then, we were flirting back and forth in school.. I was a kid, she was almost broken by then. \n\nShe\'s been clean the first full year since, as of a momth ago. She never even asked for that life. She watched everyone else doing it as she grew up. She quit to save her kids the same fate. She struggled at first, but she got the hang of it quick, completely on her own. She fucking loves her kids, she\'s terrified of giving them the life she lived. The moment she heard foster care her life turned around. Thats some rare beauty to behold in this world, she worries daily about going back. She will scarcely say hi to me today. I\'m proud of her for that.\n\nFuck meth so much. I left this world behind for six years. I didn\'t miss one night of mindless drivel. No idea what brought me back, but I know I\'m here. I\'m somewhat vain, it scares me to see this shit..'"
3msyuh,PatchAdams666,9/29/2015 1:43:17,"b'Looking for some help with fet patches. 1 mylan, 1 not so sure.'","b""Ok first time on this sub, sorry if this is a common question, or breaks a rule. I got a hold of a [couple fet's](https://www.slimgr.com/image/Rm3), but I've only had the gel patches before, and that was back when I smoked everything. The 1 on the left is an unused non-gel 50, the right is a few more 50's that have been worn for 1-4 hours each (also non-gel, are they different brand?). Basically looking for methods They could be IV'd, smoked, anything really besides worn. Don't care if I get linked to previous threads, other websites, or an explanation, just figured I would be safer with direct advice from someone who's familiar than with some random ass 3 year old forum I find online. I am googling, but having trouble finding exactly what I'm looking for or confirming it's the same patch. All I've really found is 2-3 hour ISO soaks, and I have no experience with iso. Is there a way to use water? Or can these be smoked or stuffed up my nose? I'm twacked as fuck now but I work in the morning so I'd like to come down if anyone can help me haha. Sorry again if this post breaks rules or social constructs. I'm sure this reads like being near a tweaker who won't shut the fuck up, which is real annoying when you're down."""
3msykg,ginapoppy,9/29/2015 1:40:02,b'Not being able to get on subs is ruining my life',"b""Got caught stealing poppyseeds from the grocery store today. I'm broke. When I had money I was tryn to find subs to buy - hit up people who helped me before, even posted on a cpl large FB groups asking for a lead. Nada. So desperate and so fucked that I could literally go into the ER and would get no real help. How do they expect anyone to get clean. Subs work so why are they so hard to get? \n\nAny advice?"""
3mswoa,D-stroyer,9/29/2015 1:17:22,b'DAE get snapping in and out of sleep while asleep.',"b""DAE get that where they randomly get this thing where it feels like a seizure and your trying to snap yourself awake but you do it like a bunch of times? I used the search bar and don't agree that it's simply sleep paralysis but don't know *exactly* what it is. Can be pretty unnerving too. It just happened to me and usually it only goes away by staying up for a bit or my body will keep doing it."""
3msp1p,BetchaBippy,9/28/2015 23:54:55,b'Finally...',"b""It's been 4 days now that I've been without but finally tonight I scored $65 at work. Wish me luck tomorrow...maybe I'll get to feel good..."""
3mslqb,newaccountoldaccount,9/28/2015 23:22:42,b'When payday hits but everyone is asleep...',"b""Just looked at my banks app and saw my direct deposit just posted, texted my dude but nothing. Just scraped together the black ashy contents of my druggie box to put in my bowl, taste like weed, cigarettes, dope and burnt rubber/hair. In feeling something, working a double so here's to hoping my guy can come by during my break, night ya'll."""
3mslk7,ScenicValley,9/28/2015 23:21:09,b'U-47700 While on Methadone Maintenance? Will it Work?',"b'I was wondering if anyone has experience with this combination?  I am currently on -80mg daily from my clinic, though I usually take this dose every other day.  I have recently acquired some U-47700, and even after skipping a day or so (longest I could skip would be 48-72 hours over the weekend), I am wondering if my tolerance and the potential for methadone to block the feeling of other opiates/opioids will prevent me from feeling it?\n\nI plan on trying the u-47700 by IV - but only if I think I can do a dose that will allow me to see what this substance is all about.  Any info on maximum solubility of U-47700 in water would also be very useful for my research.  \n\nOverall, I would like to hear experiences from people on MMT (at any dose, higher or lower than mine) w/ U-47700.  If anyone can provide solubility info for U-47700, i would also appreciate that very much!  Thanks in advance!'"
3mshvp,DopelesHopeFiendsyke,9/28/2015 22:48:43,b'Shooting dope',"b""I get why you guys love it so much now... I've always had a smaller shot and never really felt that great, it was similar to smoking for me. I tried a bigger shot now because I knew something wasnt right, and I was right about that. I feel like my body is a dick chilling inside a tight Swedish pussy curled up in a snuggie as a condom."""
3mshg1,Cincinasti513,9/28/2015 22:44:48,b'A different kind of dark.',"b""I know I just posted but. I've found most people describe addiction differently so I'd like to hear people to describe addiction the best they could based on thier own experience. Keep it short but to the point. I've been sober since 3-16-15 so it's a nice reminder to remember the pain. Lets see the real intelligence and ingenuity that we all have. \n\nMy favorite description goes as such. It's like being in a cave. Far back in this cave. Inside this cave it is very cold, uncomfortable, and completely absent of light. A different kind of dark. A dark and sense of impending doom which we can not accurately portray to those outside.  In this cave, I am lost, hopeless, and afraid. With nothing but the devil on my back and in my thoughts."""
3msdsn,throwawayman88,9/28/2015 22:14:50,b'About what I just did...',"b'Pop gave me $40. Wtf is $40. I still need my tobacco, like $5 in gas, and $ for my middle. Only option.....Casino.\n\nI go down there with my piece of shit $40, and boom, I run that shit up to $110. Not a ton of money, but to a heroin addict that is like a million dollars. I walk just to the exit. I was there. I could have left. I\'d be sick tonight, but then tomorrow morning I could give my fellow a call and get the meds. \n\nBut no, $100 wasn\'t enough. I needed 2, 3, or maybe, just maybe like $1000. Tonight was my night.\n\nWhat I am about to tell is 100% true, and is one of, if not, the most unbelievably unlucky thing that has ever happened to me. \n\nI play roulette. Hitting a # pays 36:1. I play sections, like 10 numbers next to each other. I put $2 on each of these numbers. \n\nThe ball is rolling, it is slowing down, it is in MY SECTION! I\'m going to win another $70! wwwwwaaaaitttt, wwwwwwwwhaaaaaaaaaaaaaaaatttt????? The ball literally was balancing between 2 numbers, both of which I had $2 on. In some sick cruel joke the ball got stuck between my numbers. The pit boss claims ""reroll"". Now I knew for fucking sure I was going to lose. I did, boom, $20 gone, then boom another $20. I left with $4. \n\nNow I am flat fucking broke until Friday, a few ativans by myside. \n\nTonight, I was an idiot, a very unlucky idiot. '"
3msdjt,handsome-ass-nigga,9/28/2015 22:12:38,b'Was supposed to buy three Roxi 15s...',"b""...got three 20mg oxymorphones instead. I guess the homie didn't realize what they sold me so I got 3 20mg Opanas for $45. It's gonna be a really good night."""
