Post Id,Author,Time,Title,Text
3nt5ew,-nobu_oKo_jima-,10/7/2015 1:16:29,b'Looking for advice on Methadone. Should I be on long term maintenance? All input appreciated.',"b""I'll try to keep this as concise as possible. Nobody likes walls of text, especially not when it's a story we've all heard a million times.\n\nLong time H user. IV all the way. Stuck in a cycle. Apart from the habit I'm a very normal person. Except from one drawer in my house and what's under my sleeves you couldn't tell I'm an addict.\n\nI spend 3-6 months in any given year clean (or mostly). Eventually the crave comes back, then I'm chipping and before you know it habited again.\n\nI've tried everything (meetings, rehab, detox, moving, sponsorship) but sooner or later I come back to habited and looking for a way out.. \n\n**Should I consider methadone long term? I've always refused it for many reasons (very hard to come off, visible side effects - always feel like I can tell someone is on it). I've been on Bupe before, but I was miserable (though circumstances were different).**\n\n**I've been told the upside to Meth is that it still provides some of that opiate comfort, effectively occupying that part of my brain that is always screaming into my life to satisfy it.**\n\n*Wouldn't that be just as temporary as my first bag? Won't I eventually need more and more for the same comfort? Will I be stuck on it forever, lose all my teeth and constantly be slightly sweaty? Isn't it like having an unsatisfying hit, like you can feel something but need more to be satisfied?*\n\nI have a month to decide - Bupe or Meth?\n\n**tl;dr** Lifer addict stuck in loop of detox and relapse. Could methadone offer me freedom from this lifestyle? I would like your honest accounts of methadone treatment to see if it might be what I need.\n\nThank you thank you thank you."""
3nt54b,1di6,10/7/2015 1:13:27,b'300mg codeine',"b""I remember first doing 300mg codeine from these three 100mg codeine contin (time release) pills when I was 16. I crushed them up then threw then bombed them. It was pure euphoria and I even puked once. \n\nnow when I do it, at age 23, I don't get anywhere near the same buzz going. What's up? I don't even have a tolerance. Was the reason I got so high the first time because it was my very first shot at codeine? Same happened to me with DXM.\n\nedit: I have no tolerance to opiates."""
3nt4pd,street_philatelist,10/7/2015 1:08:55,"b""I need yous guys's opinions""","b'Do you think if I make up flyers advertising a ""FREESTYLE DEVIL STICK COMPETITION"" and put them up all over the place that people would actually show up with devil sticks looking to compete against each other?  What sort of prize would be needed to get people to bring their own devil sticks and compete? Where is the best place to post these flyers in order to reach the main demographic I am trying to reach? Obviously vape shops and head shops but where else?\n\nAnd don\'t give me shit about this not relating to opiates because this is the bulk of a really intricate scam I\'m scheming up. And I\'m not gonna explain it because I don\'t want any of you shit lordes stealing my idea. '"
3nt0qj,Illusions-by-Jesus,10/7/2015 0:25:07,b'Narcan in Indiana?',"b""Pharmacy? Prescription? There's no centers in the area, some in IL. Will they give out narcan? What if a family member is trying to get it for the user?\n\nThanks /r/opiates"""
3nsypg,lXaNaXl,10/7/2015 0:04:41,b'Has anyone tried passion flower to help with the mental aspect of withdrawal?',"b'A buddy was talking about natural herbs and told me to try passion flower. I need to get clean because I got arrested, and my life is going to change dramatically starting with getting off opiates. I have some gabapentin and wondered how these would help get me clean. Anyone have experience with passion flower??'"
3nsx8p,RussianFloridian,10/6/2015 23:50:07,b'Man walks away with $100000 of painkillers from walgreens',b'Guy somehow got away with it!!\nCheck out the video in the article.  You can see him breaking in and walking out.\nCrazy stuff.'
3nssa1,throwawheywhey,10/6/2015 23:04:22,"b'Bunk ass shit ass motherfucking lactose ""dope"" </samuelLjacksonvoice)'","b""Please let me express my anger at having been sold eighteen bags of absolutely not even remotely dope. I usually do one two-to-three bag shot every four hours or so to stay well. I shot all of this alleged dope in under two hours and was STILL SICK. Are you fucking kidding me? This is the last time I go to backup dude because he is one mile closer to me than regular dude. I knew I had a bad feeling about it, I fuckin' knew it! I should have listened to my instincts. \n\nIn other news, I scrabbled together my last twenty bucks (seriously, some of it was change that I traded in at the Wawa closest to my home) and got four bags from regular dude, and now I am not sick anymore. After a two bag shot. Like a normal fucking day. I can't believe how much money I wasted not getting high today.\n\nSorry for the ranting and raving, you guys don't need to hear my shit. But I typed it all out anyway, so it's not getting deleted. Feel free to talk amongst the peanut gallery if you like now.\n\nTL;DR: Did you guys know amongst is not a word? I didn't."""
3nsoxr,whippetkid71,10/6/2015 22:35:22,b'used to think it took some intelligence...',"b' to be a dope fiend. And God knows I\'ve done some stupid shit over time. But I have never panicked cuz I had hives from missing a shot (rarely do-I\'m gifted,lol), or ""lent"" a rental car to a dealer. And certainly never sold a car for a handful of pills/bags or whatever. Makes me sound judgemental but you cant even put some of this shit on being new to this tragic lifestyle. \'Cept the hives (I can understand that one from a neophyte). And try to think things through, even when that fucking monkey is putting his 2 cents in the decision making process. Better to spend a few more hours, or a day sick, then do something that\'s gonnna make a hard life even more difficult in the big picture.\n I am offering a bundle, for any vehicle 2014 or newer,  motorcycles & boats included! Sorry, couldn\'t resist.  '"
3nslja,OxyJay,10/6/2015 22:07:28,b'Phil Anselmo',"b""Have you guys heard him talk about heroin addiction? There's videos on YouTube. \n\nIf you have what did you think?"""
3nsh9b,otz_8748,10/6/2015 21:32:14,b'Found out ex is addicted to heroin...Any hope for her?',"b'So I contacted my ex on Facebook that I used to date 5 years ago because I was bored and wanted to see what she was up to so we could reminisce about the good old times. We set up a meet for the weekend at her place.   \n\nI get there and when she opens the door I don\'t recognize her. Her nose has changed and her teeth are snaggly and crooked. She used to be a model and she still has the body but her face looks completely different. I don\'t know what it is, but when you look at her you just get the feel that she\'s a drug user - her face kind of ""deteriorated"" and it had that soullessness about it along with the empty stare. She was into the clubbing scene when we were dating and we would do a lot of partying together. Blow, MDMA, G, etc. I haven\'t done anything since then except the occasional drink - grew out of it.  \n\nSo we\'re sitting there and it\'s kind of awkward. She asks me if I want to do some blow tonight but I decline. She calls up her dealer anyway. ""Yeah, the usual, one gram. I have company so I can\'t hang out for very long."" Uh oh, that last line sets of some bells - she could be ""hanging out"" with her dealer for extras. We hang out and make idle conversation. Her dealer texts that he\'s downstairs and she runs down. She comes back and drops a small baggie with a gray looking substance inside in front of me - heroin. She gets a straw and a plate from the kitchen, empties the contents of the bag and crushes it with her credit card before snorting it all. My heart is crushed with it. She nonchalantly resumes the conversation while I sit there with my mouth wide open. ""So do you use often?,"" I ask while trying to be calm. ""Oh, you know how it is. I\'ve been on and off for years but I\'m quitting again next week!"" I kinda nod and wonder why I even stayed this long. But I feel sorry for her and I decide to question her further. ""How do you afford it?"" ""I\'m an escort now. I usually do an appointment a day and that\'s enough to support my habit."" ""How much is your habit?"" ""About 300 a day."" I change the subject and she puts on a movie while I wonder how the fuck she fell off the wagon like this. I left shortly after the movie.  \n\nI really liked her as a person and we stayed friendly over the years. In your experience, once you\'ve been an on and off addict for years and you hang out with drug dealers, can you ever get clean? I didn\'t judge her, but I told her if she ever needs help getting off that I could help her. She laughed at me and said she knew what she was doing and that she didn\'t need help. She said she tried getting off a week ago by getting on Suboxone (don\'t even know what that is), but that it wasn\'t going to work for her because it essentially replaces one addiction with another. She said she tried quitting cold turkey but that it\'s too painful and she\'s going to wait until her sister is in town to help her with this. It sounded like she was making excuses and telling me things that I wanted to hear. Is there any hope here? Or should I just leave this as is and not stick my nose into other people\'s business?  '"
3nsgbz,Doglog112233,10/6/2015 21:25:13,b'25mg oxy almost no effect',b'Never had a pill habit but was fucking with kratom for the past year. Taking 20-30 g of kratom/day. Been a month and a half with no kratom. I do take 3200 mg of gabapentin and 20 mg lexapro/day. \n\nTook 25 mg of perca today. Felt a elevated mood but no overwhelming warm fuzziness like i remeber in the past. Think my old Kratom habit or daily gabapentin are messing with my high?'
3nsg0l,NoTimeLikeToday,10/6/2015 21:22:40,b'Missed you guys.',"b""Hey guys! \n\nI am back from rehab and doing okay. Still don't know where I am going to settle at permanently, but I am making it work. \n\nI love you guys!!!\n\nCrystal"""
3nse1h,MyNameIsntSteven,10/6/2015 21:08:04,b'Stuck at my parents house for the night',"b""Wife and I are fighting so I dipped cause I'm not trying to hear that shit tonight. Went and got a bun and now I just found myself a oral syringe. Gonna be plugging some dope later woooo"""
3ns5t4,TizzleDirt,10/6/2015 20:03:37,b'Those here who have had to deal with other addictions and withdrawals which was worse for you?',"b""I've always heard Heroin has the worse withdrawals but then I here things like benzos causing seizures and people actually dying from alcohol withdrawal. I'm just curious if any of you had to deal with multiple substances who can share their opinion on what is the worse substance they had to detox from."""
3ns5qr,roxys4effy,10/6/2015 20:03:07,b'I never knew how hard corner boys worked.',"b""I'm not talking about the ones that deliver or you buy from. I'm talking about the ones standing on the corners all day and night just readily available. \n\nIm sitting on a porch in an open air market and this same dude has just been standing there taking hints that I never even saw while talking to some other dude. One car after another. It's kind of beautiful because I know those fucks are going to go get well or get high and that this moment I'm seeing, they're experiencing pure joy. \n\nI wonder if their legs ever get tired? I mean he's been sipping on the same bottle for a while and probably has to piss really bad. This is my first time ever being near something like this and Im so fucking fascinated. """
3nrt1j,dopefiendpussy,10/6/2015 18:26:49,"b""Can't cum while within a 24 or so hour period of using dope""","b""So, this is has been a long standing issue, but typically isn't a problem, because I usually provide myself enough a window to not use and rubbing one off is fine or while hooking up, girls won't really notice that I didn't cum. But this is my first time dating a girl over a continuous stretch of time and she has def. noticed I have yet to cum and I explained to her why. In some ways, it is great -- I can fuck her until she is too sensitive to keep going. So at least I'm making her cum multiple times a night, but I'm walking around with the bluest of balls. Do I just need to take a break from the dope for a second so I can get my cum on? I also complicate the issue by doing benzos with dope and take a large dose of an SSRI, all which makes for a dick which doesn't cum to easily. Any advice appreciated. I'm sure this gets asked all the time."""
3nrrg7,roffz,10/6/2015 18:14:56,"b""Just picked up a bun.. haven't been on here in a minute TinyChat anyone??""",b'Lesss skettt it'
3nrrep,londonflightthroaway,10/6/2015 18:14:34,b'Question on holding on international flights',"b""hello r/opiates, long time lurker here.  I am planning on going to London for a week to visit my girlfriend who is studying there for the semester.  Me and her both have somewhat of a habit that is nearly dead now, but when we are together we like to spoil ourselves once in a while and do a few blues each.  I was wondering if any of you had advice on how to bring them onto the plane safely etc.  I'm trying to bring around 6-8 blues with me.  Any help would be appreciated! Thanks!\n\nCheerio :^)"""
3nrnsc,throwwhawayy,10/6/2015 17:47:20,b'dealer with my rental',b'i made a stupid mistake telling her 1 week left now at first she claimed out her bf took it in.then she said it got impounded. rental agancy cant helpt except maybe give me one more day.\npolice ssay no impounds\n\nim implicated unless i decide to just report the car stolen.\nplease help'
3nrnkg,ChazRhineholdt,10/6/2015 17:45:48,b'How do you know when to go to the hospital?',"b""I missed a shot of BTH in the crook of my arm/elbow on Saturday. Sunday it didn't look too bad and Monday it was really red around the injection site but nothing crazy. It's much better today. It itches a lot at times which leads me to believe that it is healing. The area is about the size of a quarter and it looks like a carpet burn or something. It is not raised at all, I am able to bend and straighten my arm and there is not a lot of pain, it's just kind of sore. I have been using hot/warm compresses, ibuprofen, and neosporin on it. The area is just pink/red. How do you know when to seek medical attention? What are the signs that it will not be something that I can handle on my own at home? I obviously really don't want to go to urgent care for this, but if I have to, I definitely will. I was really worried yesterday, but it is quite a bit better today so that has calmed my nerves quite a bit. I appreciate your input and thanks for helping!"""
3nrne5,407throwaway,10/6/2015 17:44:39,"b""Does this fuck up everyone's life, or do some people keep it under control?""","b'Had surgery, was prescribed percocrt 7.5 / 325. I had 40 of them left after the pain was over. \n\nMy plan was / is to only take them on weekends. Taking one orally with fatty food, then another 4 hours later, gives me several hours of ""laying on the TV relaxed and happy""  -> good night sleep. Which is all I want. I don\'t want or need to get ""high"" I just really like that relaxed warm feeling. \n\nAnd now, in four weeks, I\'ve gone through 10 of my pills. Little faster than I planned to but not too bad. I find myself thinking about how I might get more in the future. I have chronic back and knee problems and while percocrt is probably overkill I could probably convince someone otherwise. \n\nI see a lot of posts on here about people\'s progression to snorting / smoking / shooting - I don\'t see myself doing that - but I get the impression few people do. Many people saying ""I wish I could go back in time and throw those first pills away"". Is there anyone who manages to keep their shit together with lite / recreational / non addictive use? Or is this basically an unavoidable journey?\n\nEdit: thanks for all the replies! I\'ll reply individually. tomorrow morning. Not sure if it matters, but I\'m in my 30s and an engineering manager at a fortune 100 company. I work over 60 hours a week, sleep less than 5 hours a night, and am always strung out from stress at work. I can\'t use any stimulant (even caffeine) due to an arrhythmia I have. Alcohol is fine in small doses (3 or 4 drinks a night), but beyond that it\'ll cause my arrhythmia too. The percocrt doesn\'t have any cardiac symptoms. \n\nAs for getting hooked, I have absolutely zero way to get any sort of opiate unless a doctor gives it to me. I\'m an eagle scout with no criminal record and other than talking to people on here I\'ve never known anyone who\'s sold drugs let alone bought them illegally. I\'ve got way too much to lose to engage in illegal activities, especially with people I\'ve never met. I guess my point is even if I get hooked, logistically it\'d be basically impossible for me to get anything without the help of a doctor - but if I somehow managed to get connections I could go off the deep end and blow a shit load of money. '"
3nrjxp,pstino,10/6/2015 17:19:49,b'2 cold successful cold copping stories and a psa',"b'So, let me start out by saying that this started two weeks ago and that I\'m from Baltimore. This story isn\'t about Baltimore, though. I got a new job in Delaware so I\'ve been commuting up there from where I live like 40 minutes north of Baltimore. It all started when I ran out of rigs. For the previous few days from when this started I had been sniffing my dope and with my tolerance, that just wasn\'t cutting it. I normally buy my rigs off newegg.com, but in an emergency such as this, who has time to wait for shipping. So I tried buying points from a Rite Aid in Maryland and it goes without saying that I was shut down because I don\'t have a script for them. So, it was sniffing my dope me that day. The next day, I looked on Walgreens.com, and they said that in DE I could buy syringes without a prescription and it just so happened that there was walkgreens right by my work. So When I got off, I decided the first thing I would do is go in there and try to buy some points from there. Again, denied because of a lack of prescription which I knew was bullshit because of the website. According to the look that the pharmacy tech gave me though, I knew there was no winning this battle, Now this is where things get interesting. \n\nDue to the copious amounts of time I spend on /r/opiates I knew without a doubt that I would be able to buy them in PA, especially by Philly. So when left the DE walgreens I knew right there it was going to be off to Philly I went. Now, as I got closer I started to think that maybe in addition to rigs I would be able to cop in one of those two neighborhoods that are always mentioned on here. So, I did a search of the sub and got an approximation of where I needed to go. I head up there and park a block away on one of the crossing streets, leaving everything in my car except 80$. I walk to that one street and decide to take a left. I made it about two blocks when a homeless looking dude asked me (from across the street) if I was looking. I went to the crosswalk and met Carlos. My new friend Carlos said he would take me to the spot for 20$. Beings that was in a city that I really didn\'t know anything about I figured that was a pretty fair deal. Something about his toothless grin made me feel like I could trust this guy (lol). So on our walk to the spot, he asks me if I shoot and I tell him ""yes"" he then reaches in his pocket and hands me three rigs individually wrapped in the factory plastic. SCORE! Mission 1 was already accomplished. The rest of the deal went off without a hitch. He got me my six bags I asked him for, not asking for the money until we got right to the spot and I gave him the 20 dollars he asked for. He even walked me back 90% of the way to my car so I\'d feel safe (not that I didn\'t, but it was a nice gesture). When I get back to the car i see that i had six blue bags with the ""Facebook"" stamp. I thought they were pretty good, and it had only been 13 minutes total from the time I parked my car until the time I returned with dope. SUCESS!\n\nSo, a two weeks go by, and in the meantime my main connect had decided he wanted to quit and I had been going through various other sources. I had a guy who gave FAT bags of just mediocre dope. I had a guy that gave SKIMP bags of fire. I had guys who were in between but no one who stepped up as the new number 1. So today I decide to tell my boss I have a ""doctors appointment"" and I decide to give philly another go. \n\nSo I heap up, park in the same spot as before. Use the same ATM, except this time there was this chick sitting on a curb in front of this store nodding her tits off. I tap her on the shoulder and told her that if she can take me to the dope spot I would hook her up. This time, i got 8 bags of ""knockout"" and tipped her a 20$ even though she only asked for 10$. Also again, for whatever reason she asks me if I shoot  and again I say ""yes"". She reaches into a brown paper bag she had been carrying and hand me 5 rigs still in the packaging and says to keep all 5. SCORE. We get the dope and exchange numbers DOUBLE SCORE. Also, Again I was only away from my car for less than 20 minutes. When I finally got around to doing a bag it knocked my dick in the dirt. It was awesome. \nNow, for the PSA: I feel like it is a good possibility that these bags may be cut with fent. I got super high. But it wore off in less than 30 minutes. So maybe fent, maybe not, but I just wanted to let people who cop in that one philly neighborhood to be really careful with the ""knockout"" stamp. \n\nAnyway, hope everyone is well, and having a good night. Be careful out there fam!\n\nTL;DR: cold copped in philly 10/10 would recommend. The second time may have been fent laced. Everyone be careful. '"
3nrgi7,itsjusabeesting,10/6/2015 16:55:17,b'Vein porn',"b""I don't shoot wondering what u guys think"""
3nrg4e,chasethatdragon,10/6/2015 16:52:33,b'pawn shops in queens?',"b'does anyone know of pawn shops near queens or nassau county? I have shitton of kitchen appliances and wares from my old apartment and have no $ to cop tonight.\n\nNot sourcing, I would never wanna meet internet peoples nor need any connections.'"
3nra2a,fodrugs,10/6/2015 16:10:46,b'Is this something to be worried about?',"b""This morning at about 8am I woke up and took a nice shot of dope and got ready for class. During class (around 9:30) I suddenly got nauseous and ran to the bathroom and projectile vomited all over the toilet. I went home and passed out. \n\nAround noon I woke up, ran to the bathroom and puked. Now I can't hold down anything (even water which I've been drinking by the figurative gallon) to the point where I'm dry heaving/puking bile. Are these symptoms I should be seriously worried about?\n\nI didn't miss this shot, but a day or two ago I missed a tiny bit (bout 10-15 units) in my upper left arm. Now it's slightly swollen, a little painful, and a little pink.\n\nSomething similar happened to me once before, but not as severe \n\nCould it be a bad as abscess?  have shitty health insurance so I only want to go to the hospital if this is serious. \n\nAny help would be appreciated. Thanks.\n\n\nEdit: my arm\n\nhttp://imgur.com/F2znKDK"""
3nr2tx,-DrBeardface-,10/6/2015 15:23:18,b'Kind of a morbid question',"b""With so many people on this sub passing recently (RIP. I'm broken hearted for you, and your friends, family, and other loved ones) I had kind of a morbid thought. How many people that have posted here in the past do you think died and no one knows about it? For instance, no one here knows me in real life, and no one I know in real life knows I post on here. If I died, it would just seem like I stopped posting for whatever reason. No one would ever know why. I was just thinking, that's got to have happened before, and that's really sad. I'm sorry if I have added to anyone's grief and sadness today, and I debated whether I should even ask the question, but I wanted the unknown fallen among us to be recognized in some way, even if they will remain forever anonymous. """
3nr11n,GoodRunAndNowImDone,10/6/2015 15:11:25,"b""Family found out. The game is over. It's been a ride, r/opiates.""","b""... And my world is crashing down all around me. The amount of disgust and shame is overwhelming; I'm done. I've never felt more broken and ashamed. Time to try Suboxone or Methadone, and for real this time, or rehab if that fails. I gotta get better before I lose everything else I've got left. One day I'll post this from my real account to say goodbye for real... Until then, the shame hurts too bad. Peace and love, my brothers and sisters, know that you are all loved, and not judged. </3"""
3nqybw,MyNameIsntSteven,10/6/2015 14:53:51,"b""Here's to hoping it all works out in my favor""","b'Got some guy and his kid coming tonight to buy one of my guitars off of me...I priced it at 150 or best offer so hopefully I can walk away with at least enough for a bun, a pack of smokes, and a beer.'"
3nqwkb,HOOTHROWAWAYYFOEE,10/6/2015 14:42:38,b'I just shelved 6mg of valium AMA!',"b""Nah but seriously, I'm in a good mood, my DNM dealer just sent me 2 points for free and I've only made one order before, I glad he trusts me to pay him back eventually but still I don't think he expects it. \n\nAny recent good guy dealer stories?\n\n(Also I did shelf the valium incase you thought I was joking, first time doing it too, no benzo tolerance anymore either)"""
